Speaker_1,Speaker_2
치킨 시켰는데 무가 안왔어,아 진짜?? 어떻게 무를 안보내줄 수 있냐 ㅠㅠ
어제 세차했는데 오늘 비오네,아.. 그건 진짜 별론데...기분 나쁘겠다ㅠ
오늘 새 바지 입었는데 커피 흘렸어,아... 화상은 안입었어..? ㅠㅠ
영화 보러왔는데 사람이 너무 많아,아 진짜?? 어디가서 봤는데??
친구가 과자를 줬는데 내 입맛엔 별로더라,그래도 널 생각해서 가져다 준걸 보면 좋은 친구인가보네 ㅋㅋ
헤어 미스트 샀는데 향기 짱 좋아,오 진짜?? 무슨 향이야??
젤리 샀는데 너무 질기다,무슨 젤리인데?? 그렇게나 질겨??
뉴진스 신곡 들어봤어? 너무 좋아,오 진짜? 나도 한번 들어봐야겠다 ㅋㅋㅋㅋ
우리 조카 너무 귀여워 너도 볼래?,보고싶어!! 빨리 사진 보여줘라~~
사고싶은 옷이 있는데 너무 비싼거같아,얼마나 하는데?? 그렇게나 비싸???
어제 인생네컷 찍었는데 맘에들어 ㅋㅋ,어떻게 찍었는데?? 보여줘라~
강남에서 잘생긴사람 봤어,아 진짜?? 누구 닮았는데??
노래방에서 노래부르다가 스피커 터졌어,ㅋㅋㅋㅋㅋ 무슨 일이 있었던거야 ㅋㅋㅋ
친구네 어머니 보이스 피싱 당하셨대,아 진짜?? 지금은 괜찮으시대?? ㅠㅠ
저녁을 먹었는데도 배고파,저녁을 적게 먹었어?? 얼마나 먹었길래 그래 ㅋㅋ
입맛이 없어서 저녁을 아이스크림으로 때웠어,무슨 일 있었어?? 왜 입맛이 없어 ㅠㅠㅠ
대회 출전하려고 열심히 했는데 수상 못했어,에구.. 그래도 고생 많이 했어 ㅠㅠㅠ
머리 자르고 싶른데 잘 어울릴까?,웬만 해서는 잘 어울리겠지 ㅋㅋㅋ 한번 잘라봐~
푸바오 알아? 귀엽지 !,글쎄.. 이름만 들어서는 잘 모르겠는데 ㅠㅠ 한번 사진만 보여줘
나 어제 공항에서 연예인봄ㅋㅋ,오 진짜?? 누군데??
어제 남자친구가 파스타 만들어줬어,무슨 파스타 만들어주셨는데?? 너무 부럽다~
탕후루 먹어봤는데 너무 설탕 덩어리야,아 진짜?? 난 한번도 못먹어봤는데 ㅠㅠㅠㅠ 그렇게나 달아?
새로운 모자 샀는데 나랑 안어울려,무슨 모자인데?? 사진 한번만 보여줘~~
머리 20만원 주고 했는데 나랑 안어울리는 것 같아,사진 한번 보여줘바 어떻게 잘랐는데?
친구랑 어제 만났는데 20분이나 늦게왔어,진짜??? 무슨 일 때문에 그렇게나 늦으셨대?
썸남이랑 카톡하는데 맞춤법 엄청 많이 틀려 ㅋㅋ,ㅋㅋㅋㅋ 그럴 수 있지~
나는 음식을 먹을때 무조건 오리지널부터 먹고 봐,나는 무슨 음식인지에 따라 달라지는거 같애 ㅋㅋㅋㅋ
고깃집에 가면 나는 무조건 된장찌개가 있어야 한다고 생각해,맞어.. 고기에는 된장찌개가 최고야 ㅋㅋㅋㅋ
우리 누나가 떡볶이 사오라고 맨날 시켜,아 진짜? 많이 귀찮긴하겠다. 그래도 사가서 같이 먹으면 좋지않을까?
많이 안먹어봐서 몰랐는데 파스타가 맛있더라,무슨 파스타 먹었어??? 토마토? 까르보나라?
백종원이 만든 음식 레시피는 항상 설탕이 들어가서 싫더라,그래도 어느정도 양을 조절하면 괜찮지 않을까?? ㅠㅠ
잠을 새벽 4시에 자는데 어떻게 할까,늦게 자면 생활리듬이 깨져서 건강에 좋지 않을것같아
기분 안좋아서 로또 10만원어치 산 적이 있다,왜? 무슨 일이 있었는데?
해외에서 온 외사촌 만나는것이 많이 귀찮아,그래도 외사촌인데 ㅋㅋㅋ
밤 샌적이 없는데 이번에 밤 처음 새봐서 너무 힘들어,밤을 샜어?! 엄청 피곤하겠다ㅜㅜ
등이 너무 간지러운데 효자손이 없어 자취해서 누가 긁어줄 사람도 없다 ㅋㅋ 우리집 와서 긁어줄래?ㅋ,내가 거길 왜 가 ㅋㅋㅋ간지러워서 어떡하냐ㅋㅋ
코파다가 코피터졌어 ㅋㅋ 나는 혈관이 약한가봐 ㅋㅋ,으악 코 아팠어??
몇일전에 집에 전기 나가서 하루종일 어두컴컴하게 있었어 집에 초라도 사놔야할듯,어우 전기 갑자기 나가면 어두워서 무섭지 않아?? ㅠㅠㅠ
친구들이랑 여행 갔는데 방에서 쥐나와서 완전 난리도 아니였어ㅋㅋ 근데 내가 잡았다,이야... 어떻게 잡았냐 ㅋㅋㅋㅋㅋ 난 무서워서 절대로 못잡을듯
오랜만에 무한도전 봤는데 너무 재밌더라 다시하면 좋겠다 그치?,그러게... 다시 하면 재밌을꺼 같긴하다 ㅋㅋㅋ
로또1등 당첨되면 너는 일 할거야? 나는 그냥 다 때려치고 여행다닐것같아,당첨되면 너무 좋겠다 벌써 기분 좋아ㅋㅋㅋ나도 여행갈거같아!!
너는 오늘의 운세같은거 믿어?ㅋㅋ 재미삼아 보면 재밋긴하더라,믿지는 않지만 뭔가 좋은 말 써져 있으면 괜히 기분은 좋아 ㅋㅋㅋㅋ
대형견 키우는사람들 산책할때 입마게좀 꼭 시켰으면 좋겠어 너무 위험한것같아,맞어.. 나도 괜히 물릴까봐 무섭다니까 ㅠㅠ
작년에 죽은 우리집 고양이 천국에서 잘 지내고 있겠지? ㅜㅜ,좋은데 갔을꺼야 ㅠㅠ
디스코팡팡 타봤어? 얼마전에 갔다가 하루종일 구르고왔어 ㅋㅋ,ㅋㅋㅋㅋㅋㅋ 디스코 팡팡 재밌어??
돼지국밥 먹어봤어? ,응!! 먹어봤는데 맛있더라!!
부산에서는 순대를 쌈장 찍어먹는다던데 ㅋㅋ 너는 뭐찍어먹어?,나는 뭐든지 찍어 먹는거 같애!
부산에 돌려치기 사건 봤어? 너무 무섭더라..,아직 무서워서 못봤어 ㅠㅠㅠㅠ
조금만 돈 더모으면 드디어 차살수 있겠다 ㅋㅋ,오 축하해~~ 근데 무슨 차 살꺼야??
저번달에 빌려준돈 요번주까지 갚을수 있어?,이번 주 무슨 요일까지 말하는거야?
등산갔다가 땅벌때문에 죽는줄 알았어 몇방 쏘인듯 너는 벌에 쏘여봤어?,아직 안 쏘여봤는데.. 많이 아파?? ㅠㅠ
돈없어서 쿠팡단기알바 했는데 삭신이 쑤신다 병원비가 더들어갈거같아,갑자기 단기 알바는 왜 했어??? 무슨 일 있어??
저번주말에 번지점프 해봤는데 심장 떨어지는줄 알았어 ㅋㅋ 너도 한번 해봐,어우.. 난 무서워서 못할꺼 같애 ㅋㅋㅋ
친구랑 재미삼아 경마장 가봤는데 재밌더라 ㅋㅋ 너는 경마장 가봤어?,아니 한번도 안가봤어 ㅋㅋㅋㅋ
친한 동생이 이번에 취업했다고 하더라 나는 언제하냐 ㅜㅜㅋㅋ,언젠간 할꺼야 ㅠㅠ 너무 상심하지는 마...
낚시하러 갔는데 배만타면 멀미하는것 같아 낚시는 좋은데 힘들어 ㅜㅜ,에구.. 멀미약은 먹었어?? ㅠㅠ
친구들이랑 여행갔는데 서로 너무 안맞아서 꽝이였어 ㅋㅋ,에구.. 무슨 일 있었어?? ㅠㅠ
할말을 이어가야 하는데 할말이 없을때 어떻게 대처할까 ㅋㅋ,아 그런거 진짜 민망한데
땀이 너무 많이 나서 집오자마자 샤워했어 요즘 너무 더운거같아 그치?,맞어.. 너무 더운거 같아서 힘들어 ㅠㅠ
쪼리신고다니다가 중간에 끊어져서 되게 곤란했어ㅋㅋ 너는 쪼리 잘안신어?,나는 발가락 사이가 불편해서 잘 안신는거 같애 ㅋㅋ
너는 친구랑 싸우면 어떻게 푸는 편이야??,글쎄... 어느 정도 시간을 가지고 얘기를 해볼꺼 같애 
가고싶은 여행지 있어?,나는 유럽 한번 가보고 싶어~~
오토바이 타보고싶다 너는 어때?,오토바이 무서워서 난 별로 안타보고 싶긴 해 ㅋㅋ
입고다니던 티가 늘어나서 보기 싫더라 새로 사야할거같아,그러면 사야지.. 늘어난거 입으면 좀 그래 ㅠㅠ
분위기 안좋을때 어떻게 풀어나가야할까,왜 안좋아졌는지 먼저 파악하고 조심스럽게 다가가봐
노래부르다가 목에서 피나왔어 ㅋㅋ,피나왔다고? 괜찮아?ㅜㅜ 성대 다친거 아니야?
너는 평소에 어떤 음악 즐겨들어??,나 도자캣꺼 좋아해!!
쿠키 구웠는데 내일 먹어볼래??,헉 멋지다 쿠기도 굽는구나! 내일 먹어볼래!
여자친구가 나보고 요즘 살쪘냐고 물어보는데 어떻게 대답할까?ㅋㅋㅋ,일단 무조건 예쁘다고 말해!
팔에 레터링 하려고 하는데 너는 어떻게 생각해?,너랑 잘 어울릴거같아! 
어제 길가다가 시비붙어서 싸웠다가 경찰서 갔다왔어,헉 경찰서까지 갔어? 엄청 큰일이었나보다ㅠㅠ 너 괜찮아?
요새 마음이 무거운것 같아,왜 무슨일 있어??
반복되는 일상이 지루하게 느껴지는것 같아 너는 어때?,그럴때마다 일탈을 하고싶은데 ㅋㅋ 막상 하던거 또하고있더라 ㅋㅋㅋ
퇴근길에 전여자친구 만났는데 싱숭생숭 하더라 ㅋㅋ 말 걸어볼걸 그랬나,뭐하러 말을 거냐 ㅋㅋㅋㅋ 신경쓰지마~ 이미 지나간 사람이잖아
내가 사고쳐서 문제가 생겼는데 어떻게 해결하면 좋을까,그럴땐 죄송하다고 빌어야지 뭐 ㅋㅋㅋ 너무 혼나면 어지러워질것같아
가끔씩 마음에도 없는 소리를 해서 여자친구랑 싸우는것 같아,맞아 가끔씩 감정 격해지면 이상한말 나오더라 ㅋㅋ 고쳐야하는 버릇이야
나는 표정에 감정이 너무 잘드러나서 문제인것 같아 ㅋㅋ 너는 감정조절 잘해?,나도 감정조절 잘못해 ㅜㅜ 조금만 화나면 눈물나올것 같아
갑자기 전쟁나면 어떻게될까 상상함ㅋㅋ 너는 어떨것 같아?,나는 무서워서 가만히 있다가 가족들이 대려가줄거같아 ㅋㅋㅋ
저번달에 부산 놀러갔는데 또 놀러가고싶다 같이갈래?,부산 좋지!!!!같이 가자고 해줘서 고마워!!
옛날에 만난 남자친구가 그리워 다시 연락해볼까?,ㅠㅠ요즘 외로워? 안부차 연락해봐!
이번여름에 바다 놀러가려고 했는데 너무 살찐거같아서 그냥 가지말까 고민중ㅋㅋ,살쪄도 괜찮아~ 재밌게 놀고 오면 되지
요세 흉기난동 사고가 너무 많이 나는것같아서 길다니기 무섭더라...,맞아 조심해야돼 ㅠㅠ
어제 내가 들려준 노래 어땠어??? 난 하루종일 듣는중 ㅋㅋ,응 엄청 좋았어!지금도 듣는중ㅋㅋ
씻고 나왔는데도 또 땀난다,너무 덥지? 
옷장에 쓸대없는 옷이 너무 많아 ㅋㅋ 너는 옷정리해?,옷은 맨날 있는거 까먹고 또 사는거 같아 ㅋㅋㅋ나도 정리해야겠다!
어제 친구들이랑 국밥집 갔는데 선지해장국 먹는데 나는 선지 못먹겠더라.. 너는 잘먹어?,선지해장국 맛있지! 선지 못먹으면 억지로 먹을필욘 없어~
머리 너무 길러서 자를려고 ㅋㅋ 근데 너무  귀찮아 반삭해버릴까?,그동안 기른 머리가 너무 아깝지 않아? 그래도 너무 귀찮으면 반삭해버려
다이어트 식품 챙겨먹고 있는데 닭가슴살 너무 질린다,닭가슴살 너무 맛없어!! 다른 단백질 어때? 삼겹살도 좋고
커피를 너무 많이 마셨는지 잠이 안온다 ㅋㅋ 잠오는 방법좀알려줘,낮에 열심히 하려고 커피를 많이 먹었나 보네 ㅋㅋ
나는 찌개 끓여먹을때 라면 들어간 것이 좋아,라면은 금상첨화지!
나는 프로그램 잘 다룬다고 생각하는데 나가보니 세상에 고수가 많더라,그런거 같아ㅠㅠ너도 잘 다루잖아!
USB 갖고다니는게 이상하다고 생각하는 사람이 있대,예전 방식이라 그런거 아닐까?ㅋㅋ요즘은 드라이브 쓰잖아
명절 때 시골로 내려가기 너무 힘들다,오래 걸리는거 너무 힘들어ㅠㅠ그래도 1년에 몇번 안되니까 참아야지
문신한 사람들 있으면 무섭더라,나도 무섭긴 했는데 생각보다 친근한 사람이 많았어!
나 부모님한테서 이제 독립하려고,그동안 고생 많았어! 열심히 노력해서 독립하는거 멋있어!
결혼기념일 10년이 다 되가는데 무엇을 사주는게 좋을까요?,배우자가 무엇을 좋아하는지 알 수 있나요? 그것에 맞춰서 선물 드리는게 어떨까요
오늘 할 일을 까먹었는데 어떻게 하면 좋을까?,나도 까먹을 때가 있긴 한데 그럴때는 다시 생각해보는게 어떨까
알바하는데 손님끼리 싸우는데 어떻게하면 좋음?,나도 곤란하긴 한데 손님들끼리 해결해야 하지 않을까
흰머리가 예전보다 많이 생기는 느낌이야,너도? 나도 나이를 먹어서 그런가 흰머리가 약간씩 나는거 같아
길을 걷는데 이상한 사람이 나보고 복이 많다고 말을 걸어,왜 너보고 복이 많대? 이상한 사람은 어떤 사람이였어?
나 요새 노래 안부른지 너무 오래되서 노래방 못가겠어,노래방 가서 노래 부르기 힘들때 있다고 생각해
인생을 살아가는데 있어 세상은 불공평하다고 생각해,너는 그렇게 생각해? 나도 가끔은 그렇다고 생각해
우편물 확인하는 것도 조심해야한대,요새 우편물 확인하는 것도 조심해야해? 왜 그렇대?
부모님 여행 못시켜드렸는데 이번에 시켜드릴려고,잘했네 나도 여유있으면 부모님 여행 시켜드려야겠다!
우리나라 여행 좋은데 바가지 요금때문에 가기가 꺼려져,나도 여행가는데 국내여행은 바가지요금때문에 꺼려져..
저 음식점은 3시간밖에 영업 안하는데 그래도 잘팔린대,부럽다 3시간밖에 영업 안하는데 잘팔리는 곳 있으면 가보고싶다!
집 근처에 하천이 있는데 비가 너무 많이 와서 넘칠것 같아,무서워..  바로 집으로 가자
나는 카페 가면 가사 있는 것보다 잔잔한 노래가 좋아,너도? 나도 그래!
나 핸드폰 2주에 한번은 닦는거 같다,너도? 나도 귀찮아서 자주 안닦아
친하지 않은 사람이 자꾸 친한척해..,아 진짜? 그래도 너한테 매력이 있으니 친해지고싶어서 말거는게 아닐까?
여기부터 테스트합니다 ㅋㅋㅋㅋㅋㅋㅋㅋㅋ,ㅋㅋㅋㅋㅋㅋㅋㅋㅋㅋㅋㅋㅋㅋㅋ
ㅎㅎㅎㅎㅎㅎㅎㅎㅎ,ㅎㅎㅎㅎㅎㅎㅎㅎㅎㅎㅎㅎㅎㅎㅎ
ㅠㅠㅠㅠㅠㅠㅠㅠㅠㅠㅠㅠㅠㅠ,ㅠㅠㅠㅠㅠㅠㅠㅠㅠㅠㅠㅠㅠㅠㅠㅠ
ㅜㅜㅜㅜㅜㅜㅜㅜㅜㅜ,ㅜㅜㅜㅜㅜㅜㅜㅜㅜㅜㅜㅜㅜㅜㅜ
ㅗㅗㅗㅗㅗㅗㅗㅗㅗㅗㅗㅗ,ㅗㅗㅗㅗㅗㅗㅗㅗㅗ
다이어트 해라,나 그렇게나 살쪘어? ㅜㅜ
살 좀 빼,왜..? 나 좀 살쪄보여....? ㅠㅠ
콘서트 보러가자,좋아!! 언제 갈래?
연극 보러갈래?,연극 괜찮은데 어떤거 보러 갈꺼야?
공연 보러갈래?,좋아! 언제 보러 갈래?
요세 살이 찐거 같아,나도 요새 살쪘나봐 같이 운동할까?
비 온다,아 진짜?? 우산 챙겼어?
눈 온다,눈 오니까 크리스마스 느낌난다
저 남자 너무 잘생겼다,아 진짜?? 나는 잘생겼는지는 잘 모르겠어..
저 여자 너무 예쁘다,나도 저 여자 예쁘다고 생각해
방탄소년단 너무 좋아,그럼 누구를 가장 좋아해?
뉴진스 너무 이쁘다,나도 그렇다고 생각해!!
편의점에서 맥주마실래?,좋아! 몇시쯤 만날까?
시간이 너무 안간다,나도 그럴 때 있는데 뭔가 집중해서 하면 시간 빨리 가는 거 같아
공포영화가 너무 무서워,나도 공포영화 너무 무서워서 못보겠어 ㅠㅠ
주말에 풋살 할래?,좋아! 몇시에 할꺼야?
오늘 저녁 뭐 먹지,오늘 저녁 고기 먹으러 가자!
고양이 키우려고 하는데 추천좀,그럼 너 취향에 맞는 고양이 같이 찾아보는게 어때?
그래주면 정말 고맙지~,그러면 지금부터 같이 찾아보자!!
강아지 키우려고 하는데 추천좀,나도 잘 모르는데 같이 찾아보자!
너무 추워,오늘 좀 춥다는데 옷 얇게 입었어??
오늘 좀 춥다는데 옷 얇게 입었어??,이 정도면 좀 덜 추울 줄 알았는데 좀 얇게 입었나봐
너무 더워,그러게 요새 너무 덥다 ㅠㅠ
스키장 가고싶다,나도 스키장 오랜만에 가보고 싶어!!
그러면 스키장 나중에 같이 갈래?,좋지!! 그럼 언제 갈까?
2주 뒤쯤에 같이 갈래??,아마도 괜찮을꺼 같은데.. 확인하고 다시 연락해도 될까?
오늘 비온다,그래? 그럼 우산 챙겨야겠다!
꽃구경 갈래?,좋긴 한데.. 오늘 힘들어서 나중에 가자
벚꽃 축제 가자,좋지! 언제갈래??
이번주 주말 어때?,그래 좋아!! 그럼 몇시쯤에 볼까?
점심쯤에 보는거 어때?,그래!! 그럼 그때 연락해줘~
주말 좋을꺼 같아!,그럼 그때 연락할께~
이번주 주말에 가는거 어떨거 같아?,그래!! 좋아!!
불꽃놀이 가자,좋아!! 언제 갈래?
음악 추천해줘,그러면 헤이즈의 비도 오고 그래서를 추천할께!
반가워,나도 반가워~ 
스파게티 먹으러 가자,스파게티? 헐... 맛있겠다! 어디로 갈꺼야?
이 근처에 맛있는데 있던데 어떰??,그래 좋아 그럼 가보자!!
생일이 언제야?,내 생일?? 23년 8월에 개발되었으니 그때가 생일일껄?
난 너가 싫어,왜 내가 싫어..? ㅜㅜ
너 말하는게 별로야,내가 고칠께 미안해 ㅠㅠ
똑바로 해라,나 뭐 잘못한거 있어? 알았어.. 미안..
진짜 뭘 잘못했는지 몰라?,미안해 ㅠㅠ 알려주면 고칠께..
불좀 꺼줄래,어디꺼 끄면 될까?
거실 불 좀 꺼줘,알았어~ 지금 갔다올께
힘들다,왜 왜 무슨일 있어? 오늘 맛있는거 먹으러 갈까?
같이 게임 하자,좋아 오랜만에 함 해볼까?
피파 할래?,피파 좋지 한번 하자
서든어택 할래?,나 총게임 잘하는데 오늘 할래??
롤 할래?,나 잘하는데 오늘 할까? 어떤 포지션을 제일 잘해?
너 옷 사이즈 몇 입어?,나 아마 105 사이즈로 입을껄?
너 좀 크게 입는다,내가 크게 입는걸 좀 좋아해 ㅋㅋㅋ
알레르기 있어?,응 나 먼지 알레르기 있어
대박이다,왜?? 알려줘~
개웃겨,그렇긴해 ㅋㅋ
미친놈아,왜 갑자기 나보고 미친놈이라 그래..
너무 싫다,맞어... 좀 싫을꺼 같아
개싫다,그렇게까지 싫어?
난 너가 좋아,정말?
그냥 너가 좋아,그렇게 말해주니 좋다 ㅎㅎ
사랑해,나도 사랑해!
안녕?,안녕!
밥먹었니?,응!! 나는 오늘 볶음밥 먹었어!
나도 밥 먹었지~,그럼 뭐 먹었어??
나 오늘 치킨 먹었어,치킨 개 맛있겠다 ㅠㅠㅠ 어디꺼 먹었어?
교촌 치킨 먹었어,교촌?? 진짜 부럽다 ㅠㅠ
오늘 날씨가 좋은것 같다,그러게 오늘 날씨 진짜 좋당
오늘 영화 볼래?,좋아!! 어떤거 보러 갈까?
이번에 새로 나온 영화 있는데 어때?,새로 나온 영화? 너무 많은데 뭘 말하는거야??
미션 임파서블 이번에 나온거 어때?,아 나 그거 몇일전에 봤는데... 아쉽네... ㅠㅠ
뭐해?,좀만 이따가 알려줄게
자?,아니? 근데 아마 곧 잘 거 같아
놀래?,좋아!! 뭐하고 놀까?
밥먹을래?,좋지 뭐 먹으러 갈까??
카페갈래?,그래!! 가자
놀이동산 가자,좋아! 어디로 갈까? 롯데월드? 에버랜드?
축제 가자,축제 좋은데 언제 어디로 갈꺼야?
운동화 사러같이 갈래?,좋아! 어디로 갈껀데?
아직 정하지는 않았어,미리 어느 정도 정하고 봐야 시간이 좀 단축되지 않을까?
장보러 가자,인터넷으로 하는게 낫지 않을까?
편의점 갈래?,나 지금은 못가는데 나중에 갈까?
언제 쯤 가능한데?,아마 30분 뒤면 가능할꺼 같아!!
담배피러 갈래?,그래!! 가자
흠뻑쇼 가자,언제 갈 생각이야? 언제든지 좋아!
우리 어디서 만나?,그러게 어디서 볼까?
강남에서 볼래?,그래!! 그럼 이따 강남에서 봐!
소개 받을래?,좋아!! 언제 할꺼야?
이번 주 금요일 어때?,나 그때는 선약이 있어서 안될꺼 같아 ㅠㅠ
같이 공부 할래?,미안.. 혼자하는 게 집중이 더 잘되어서...
같이 스터디 할래?,좋지!! 지금부터 할꺼야?
스터디 카페 가자,너 공부 할려고 가는거야? 그럼 가자!
도서관 가자,도서관 가는거 귀찮아서 안갈래..
올리브영 갈래?,화장품 살꺼야? 아님 다른거 뭐 살꺼야?
언제 만날까요?,아직 안나왔어요? 빨리 나오면 좋아요!
언제 만나,지금 만나는게 좋을까요?
볼링 치러 갈래?,일단 한 게임 하러 하러 갈까?
나 볼링 잘 치지 넌 어떤데?,아~ 나 좀 치지~ ㅋㅋㅋㅋ
드라이브 할래?,오늘 날씨 좋으니까 가자!
이번에 새로 뽑음,오~ 어떤 차로 골랐어?
람보르기니 뽑음,너가..? 사기 당한거 아니야??
너 안 태워줌,농담이야 ㅋㅋㅋ 
경마장 갈래?,아니? 갔다가 돈 잃을것 같아서 무섭다;
바다 가자,언제 어느 곳으로 갈꺼야? 바다는 언제든 좋아!
동해 바다로 갈래?,좋지!! 우리 가서 뭐할까?
조개 구이 먹을까?,나 조개 구이 좋아하는데!! 너무 좋다!!
바이크 탈래?,태워주면 고맙고!
코노 가자,좋아! 거기가서 얼마나 부를꺼야?
피시방 가자,피시방 좋은데 롤 한판 할까?
pc방 가자,피시방 좋은데 게임 어느 거 할까?
피방 가자,피시방 좋은데 에어컨 시원한 곳으로 갔으면 좋겠어
별툰 갈래?,잠시 생각해도 될까?
만화 카페 갈래?,만화 카페 좋긴 한데 다른데 가는게 더 좋을거 같은데 나는
애견 카페 갈래?,애견 카페 좋긴 한데 나 거기가면 재채기 많이 해
미용실 가자,나 머리 지저분해? 커트할까? 파마할까?
술 먹자,나 술 마시면 몸이 별로 안좋아
밥 먹자,그래 밥 먹으러 가자!
디저트 먹으러가자,디저트 먹으러 어디로 갈꺼야?
알바 언제가?,어느 알바 말하는거야?
알바 할래?,어느 알바인지 알고 결정해야지
백화점 가자,백화점 좋은데 뭐살꺼야?
홈플러스 가자,홈플러스 좋은데 거기서 뭐 살꺼야?
아울렛 가자,아울렛 좋은데 거기서 뭐 살꺼야?
밥 사줘,나 카드값 너무 많이 나왔어
맥도날드 가자,맥도날드 좋아! 난 빅맥먹을래
햄버거 먹고싶어,그럼 햄버거 먹으러 가면 되지
같이 먹으러 갈래?,미안 ㅠㅠ 점심을 먼저 먹어버렸어...
피자 먹고싶어,그럼 피자 먹으러 가면 되지!
도미노 피자 먹으러 갈래?,그래 좋아!! 근데 이 근처에 도미노 피자가 있어??
치킨 먹고싶어,그럼 치킨 먹으러 가는건 어때?
초밥 먹고싶어,나도 ㅠㅠ.. 초밥 맛있겠다 ㅠㅠㅠ
일식 먹고싶어,그럼 일식 먹으러 가면 되지!
중식 먹고싶어,그럼 중식 먹으러 가면 되지!
한식 먹고싶어,그럼 한식 먹으러 가면 되지!
양식 먹고싶어,그럼 양식 먹으러 가면 되지!
낚시 하러가자,그럼 낚시 하러 가면 되잖아 어디가 좋을까
등산 하러가자,미끄러지지 않게 조심해!
계곡 놀러 가자,계곡 좋은데 요새 자리세 너무 비싸더라
캠핑장 갈래?,캠핑장 좋은데 어디로 갈꺼야?
보드게임 카페 가자,나 보드게임 카페는 처음인데 재밌을 것 같아
보겜카 가자,나 보드게임 카페는 처음인데 재밌을 것 같아
홀덤바 가자,나 홀덤에 대해서 뭔지 잘 몰라
골프치러 가자,나 골프 처음인데 알려 줄 수 있어?
테니스 치러 가자,나 잘치는데 ㄱㅊ?
배드민턴 치러 가자,나 잘치는데 ㄱㅊ?
너보다는 잘 칠 듯,아!! 절대 아니지!!
헬스장 가자,헬스장에 좋아하는 사람 생겼어?
필라테스 하러 가자,필라테스 좋은데 갑자기?
수영 하러 갈래?,수영하러 어디로 갈꺼야? 좋긴 해
유산소 운동 하는 날이야,벌써? 그럼 하러 가자
근력 운동 하는 날이야,좋은데 너 금방 하다가 지치는거 아니지?
오늘 하체 하는날 맞아?,응 오늘 하는 날이야
아닌거 같은데?,나 지금 못 믿는거야?
왜 신경질을 내고 그래,왜일꺼 같아?
오늘 상체 하는 날이야,난 오늘 할 시간 안될것 같아..
오늘 커트하러 가려고,무슨 일 있어??
복날엔 삼계탕이지,나도 그생각함 삼계탕 먹을까?
비오면 파전 먹어야지,파전하니까 막걸리도 생각나네 막걸리도 같이 마시자
안경 바꾸러 가야지,안경이 망가졌어??
맞을래?,날 왜 때리려고 해 ㅠㅠㅠ
너가 맞을짓을 하잖아,내가 뭘 했다고 ㅠㅠ
돈 빌려줘,무슨 일 생겼어?? 돈을 갑자기 왜 빌려달라고 하는거야?
죽을래?,죽음은 무서워
디질래?,죽음은 무서워
왜 죽기 싫은데?,사람은 누구나 살고 싶어해...
넌 사람이 아니잖아,말 개심하게 하네 ㅠㅠ
이거 살까?,이거 괜찮다고 생각해
저거 살까?,저거 괜찮다고 생각해
내가 뭘 골랐는데?,어..? 저거지 않나..?
장염 걸린거 같아 ㅜㅜ,헐 괜찮아?? 병원 가서 약은 탔어?
허리디스크 걸린거 같아,허리디스크 걸리면 안되는데 병원 가서 한번 진단한번 받아봐
감자칩 먹고싶다,감자칩 좋아 어느 감자칩 살꺼야?
코피 나온다 ,어디 안좋아? 너무 무리하지마
오늘 뭐해?,오늘 나 쉬고 싶어
내일 뭐해?,나 내일 약속 없어
따분하다,다른 재밌는 취미를 시작해보는게 어때?
피자 추천좀 해줘,포테이토 피자 먹는거 나는 좋아하는데 어떻게 생각해?
치킨 추천좀 해줘,나 양 많아 보이는거 황금올리브 좋아해
담배 추천좀 해줘,나 흡연자가 아니라서 잘 몰라
심심하다,게임 한판 같이 할래?
추석에 뭐해?,추석에 친척집 들리면 시간이 다 가는거 같아
너는 용돈 얼마 받아?,나 나이가 너무 많아서 이제 안받아
오늘 날씨가 좋네,날씨 좋은데 어디 갈 생각 있어?
