Speaker_1,Speaker_2
발목이 삔거 같아,발목 괜찮아? 어디 아픈거 아니지? 병원은 가봤고?
요리 유튜브 추천좀해줄래?,나는 백종원 영상보고 많이 따라해
여름엔 공포영화가 끌리는거 같아,나는 공포영화 재미없고 무섭기만 해서 별로 안좋아해
모기 많이 물려서 너무 짜증난다,전기모기채 하나 사는게 어때? 혹은 모기향이나
땀띠 생겨서 등이 너무 간지러워,씻는게 좋지 않을까 간지러운거 안좋아
더울땐 아이스크림이 최고같아,나도 그렇게 생각해! 아이스크림 어떤거 먹어?
어디 갈 거야?,오늘 고깃집 땡기는데 괜찮아?
오늘 뭐 할 거야?,오늘 딱히 생각해본적은 없어
밥 먹었어?,나 오늘 볶음밥 먹었지
뭐 먹을까?,오늘 고기 어때?
뭐 마실까?,맥주가 한잔 땡기는데 맥주 한잔 어때
뭐 하고 놀 거야?,오랜만에 볼링장 한번 갈까?
뭐 할까봐?,음.. 일단 해봐!
뭐 입을까?,반팔티 입는거 어떻게 생각해?
뭐 해볼까?,지금? 좋아!
몇 시에 만날까?,너가 제일 좋은 시간대에 만나
뭐 할 생각이야?,나도 생각해봐야해
뭐 생각해?,글쎄 어느 생각할까?
그거 어때?,난 이거 좋은거같아
최근에 뭐 했어?,최근에 나 공부하는 중
뭘 보고 있어?,유튜브 보고있어 지금
지금 뭐해?,지금 너랑 대화하는거 외에 하는거 없어
무슨 일 있어?,아니? 아무일도 없는데 갑자기 왜
기분 어때?,오늘 나 기분 좋은거같아
왜 그래?,왜그러냐니?.
오늘 기분 어때?,나 지금 그냥 그런것같아
어제 뭐 했어?,내가 어제 뭘 했더라..
주말에 뭐 할 거야?,나 오늘 집에서 쉴듯?
취미가 뭐야?,나 게임 좋아해. 요즘은 RPG게임이 제일 재밌는것같아
좋아하는 음식 뭐야?,나 고기류를 다 좋아해 최근에는 삼겹살에 꽂혔어
싫어하는 음식 뭐야?,나 매운음식은 좀 그래 매운음식을 먹으면 다음날 속이 아파
좋아하는 색깔 뭐야?,파랑색 좋아해
주로 뭐 입어?,요새 나 검은색 반팔이나 흰색 반팔티 입어
뭐 좋아하는 유형의 영화야?,나 코미디 영화 같은거 좋아해
가장 좋아하는 영화가 뭐야?,나는 극한직업 좋아해!!
어떤 장르의 음악을 좋아해?,나 잔잔한 노래 좋아해 클래식 같은거
이번 주말에 뭐 특별한 계획 있어?,아니 딱히 특별한건 없어
요즘 잘 자고 있어?,아니 잘 못 자는거 같아 잘 자야하는데..
어제 늦게까지 어디서 놀았어?,술집에서 술 마시고 뻗었어..
운동 좋아해?,나 운동 하면 몸이 너무 힘들어
최근에 본 재미있는 영화 뭐야?,나 최근에 영화 안봐서 잘 모르겠어
요즘에 뭐 신기한 일 있었어?,아니? 신기한 일 없는데 갑자기?
맛있는 카페 추천해줄래?,나 요새 바나프레소 외에 간 적이 없어
오늘 뭐하면서 놀까?,나 잘 모르겠는데 너가 정해줬으면 좋겠어
뭐 할까?,모르겠는데 생각나는거 있으면 말해줘
학교나 회사에서 어떤 일 있었어?,아니 특별한 일이 있었던 건 아니야
내일 뭐 할 거야?,뭐하긴 공부해야 하지 않을까
언제까지 일할 거야?,글쎄? 퇴근 시간될때까진 해야지? 그때 되면 기운을 찾게 되더라
뭐 먹고 싶어?,나 오늘 치킨이 땡겨
지금 배고파?,잘 모르겠는데 별 생각이 없는것 같아
친구들이랑 언제 만날 거야?,오늘 저녁에 만나재
살 좀 빼려고 운동 언제 시작해?,오늘부터!
여행 가고 싶어?,여행이야 항상 가고 싶긴해 시간만 되면
언제 다음 휴가 있어?,아마 추석이지 않을까
요즘 스트레스 어때?,너무 많이 받아서 흰머리가 나고 있는거같아
좋아하는 스포츠는 뭐야?,내가 보는건 축구를 좋아하는데 하는건 농구를 좋아해
오늘 뭐 먹을지 추천해줘!,치킨 좋아해? 먹을까?
주말에 뭐 특별한 계획 있어?,아니 특별한 계획은 없어 집에 있을듯
요즘에 뭐 좋은 드라마 있어?,DP 요새 핫하던데 DP 어때?
언제까지 걸릴까요?,오늘까지 제출 할 수 있을 것 같습니다
뭐 입으면 예뻐보일까?,옷 디자인이 중요하지 않을까?
지금 뭐하면서 이야기 하고 있었어?,나 집에서 운동 하고 있지
뭐 시켜먹을까?,족발 땡기는데  족발 어때?
놀만한 곳 없을까?,놀만한 곳이야 피시방이나 노래방 같은 곳 외에 딱히 없지 않아?
요즘 유행하는 음식이 뭘까,요새 로제떡볶이가 그리 유행이라 하더라
어떤 옷이 나에게 어울릴까,아무거나 입어도 다 잘 어울리는거같은데?
너는 좋아하는 자동차 있어?,나 재규어사의 재규어 F타입 제일 좋아해
이번달에는 어떤 일을 했어?,나 저번에도 말했는데 계속 공부하고 있지
어떤 노래를 들으면 기분이 좋아질까?,클래식 음악 들으면서 자보는거 어때?
새로운 취미를 가지고 싶은데 추천해줘,악기 배우는걸 추천해볼게 기타같은거
시도해보지 않은 운동이 있어?,내가 운동을 잘 안해서 모르겠다
최근에 받은 영감이 있어?,아니 난 영감이 잘 안떠올라서 모르겠어
너에게 소소한 행복은 뭐야?,맛있는 음식을 먹을때가 그래도 소소하게 행복을 느끼는거같아
국내 여행 하려는데 갈 곳 추천좀해줄래?,동해바다 추천해볼게
너만의 비밀장소가 있어?,딱히 없는거같은데?
너는 어떤 직업을 가지고싶어?,나 지금은 개발자 한번 해보고 싶어
요즘 제일 인기가 많은 노래가 뭘까,나 관심은 별로 없는데 뉴진스라는 그룹이 많이 뜨는거 같아
너는 요리 잘해?,나 요리 나쁘진 않게 하는거같아
애완동물 키워?,아니 나 애완동물 안키워 신경쓸게 너무 많아서
떡볶이 먹을건데 추천해줘,나는 그냥 일반적인 떡볶이를 제일 좋아해 매운거면 엽떡 추천할게
대화할때는 자신감을 가지고 말해봐,내가 자신감이 없어보여? 그렇게 말한다면 알았어..
너는 블로그를 운영해?,아니? 나 블로그 운영 안해 갑자기?
피아노 공연 가본적 있어?,나 피아노 공연 가본지 너무 오래 된거 같아 기억도 안나
미술 전시회 가본적 있어?,미술 전시회 가본적 있긴 한데 너무 오래되서 기억이 잘 안나네
농장 가본적 있어?,아니 직접 찾아가 본적은 없어서 잘 모르겠어
너는 좌우명이 뭐야?,딱히 생각해 본적은 없는데 인생은 타이밍이고 건강해야 뭐라도 할 수 있다는 거? 인 것 같아
너는 새로운 언어를 배우고 싶다면 어떤 언어를 배우고 싶어?,나는 스페인어랑 프랑스어 생각하고 있어! 쓰는 인구가 많아서
너만의 인생 명언이 있어?,군대에서 인생은 타이밍이라는게 귀에 박혀서 여전히 떠오르고 평생 떠오를 거 같아
가장 좋아하는 동물은 뭐야?,나 코끼리를 제일 좋아하는 거 같아!
너는 연애 경험이 있어?,아니 딱히 없어 갑자기 물어보는 이유가 있어?
군대 갔다왔냐?,당연히 갔다왔지 안갔다왔을리가 있나
이삭토스트 좋아해?,나 토스트 자체를 별로 안좋아해서 많이 가진 않는데 괜찮아
너는 자주 연락하는 친구가 몇명이나 있어?,나 친구가 그렇게 많은 편이 아니라서 말하기 좀 그렇네
너는 습관이 뭐야?,내 습관? 앉으면 자꾸 조는거 같아
네일아트 배웠는데 너한테도 해줄까?,진짜? 고마워 ㅠㅠ 이쁘게 해줘야해  ㅎㅎ
파마하려는데 어떤 펌이 좋을까,펌도 종류가 많던데 너는 어떤 스타일로 고민하고있어??
염색 하려는데 색깔 추천해줘,밝은 갈색이 무난하고 좋지 않을까? 연노랑색이나
좋아하는 아티스트 있어?,난 헤이즈가 좋더라! 너도 한번 들어봐 분명 좋아할거야 ㅎㅎ
좋아하는 음식이 뭐야,나 튀김류를 제일 좋아해 감자튀김을 제일 좋아해
너가 잘하는 운동 있어?,내가 잘하는 운동? 지금은 안해서 잘 모르는데 농구를 잘했었어
이번 휴일에는 뭐하고 지낼 생각이야?,휴일에 한숨 자는게 제일 좋은거같아
최근에 본 영화가 있어?,최근에 본게 아바타2 봤던거같아 영화관에서
너는 어떤 여행지가 제일 좋았어?,잘 모르겠네 기억이 잘 안나
재미있는 꿈 꿔본적 있어?,재밌는 꿈은 기억이 안나는데 무서운 꿈을 많이 꿨어
가장 인상 깊게 읽었던 책 있어?,책을 내가 잘 안읽기도 하고 공부하느라 바빠서 잘 모르겠네
첫사랑은 언제야?,아 그런건 비밀이야 ㅎㅎ
시간여행 가고싶다 ,진짜? 시간여행이 되면 언제로 돌아가고 싶은데??
받아본 선물중에 기억에 남는게 있어?,난 생일날 친구가 카드지갑 받은거! 꼭 받고 싶었던거였거든
낭만적인 데이트 아이디어있어?,말해도 실현시키기 힘들거라고 생각해 큰 공간을 빌려보는게 어떨까
유명인과 만난다면 누구를 만나고 싶어?,코미디언! 나는 유재석씨도 좋지만 박명수씨 한번 만나보고 싶어
미래에 이루고 싶은 목표가 있어?,뭐 하나 잘 되서 이름을 남기는 거? 였으면 좋겠어
기억에 남는 영화 대사가 있어?,아직 한발 남았다 가 제일 기억에 남아
너는 짜게 먹는 편이야?,짜게 먹는거 좋아하긴 하는데 건강 생각해서 최대한 덜 짜게 먹으려고 해
인생에서 가장 중요한 가치가 너는 뭐라고 생각해?,돈이 물론 중요하긴 한데 나는 그것보다도 신뢰가 제일 중요하다 생각해
요즘 너무 범죄가 많이 일어나는 것 같아,나도 그래서 너무 무서워 ㅜ
신림역 사건에 대해 어떻게 생각해,가해자가 어떤 인생을 살았으면 저렇게까지 변질될 수 있는지 걱정이 되더라
칼부림이 일어나는 상황이면 너는 어떻게 대처할거야?,내가 당하는 입장이였으면 아무런 대처도 하지 못하지 않았을까
가장 좋아하는 방송 프로그램이 뭐야?,내가 티비를 잘 안보긴하는데 무한도전을 제일 좋아했었어
어릴 적 무서웠던 것과 극복한 경험이 있어?,나 어릴적에 강아지를 무서워했는데 시간이 해결해주더라
스트레스를 푸는 방법을 알려줘,그냥 한 숨 자면 스트레스고 걱정이고 약간은 날아가더라
좋아하는 애니메이션 있어?,아니 잘 모르겠어? 귀멸의칼날이나 스즈메의 문단속 같은거 들어본 적은 있어
오늘 아침 뭐 먹었어?,내가 새벽에 많이 자다 보니까 아침은 안먹고 점심부터 먹어
너의 이상형은 어떤 사람이야?,방향성을 제시해주는 사람?이 좋은거같아
노래 잘불러?,아니 나 너무 저음이라 노래 잘 안불러
주변 친구들에게 배운점이 있어?,실수를 많이 하더라도 당당하게 살더라고
너는 새로운 도전을 즐겨?,할것이 많은데 즐긴다긴 보단 할려고 노력하지
주변 사람들과 어떤이야기를 주로 하니,글쎄? 뭐 배우는지에 대한 것을 많이 이야기하는거 같아
너는 맨탈관리 어떻게해?,나? 자거나 먹거나 유튜브 보는걸로 많이 해
가족이랑 사이가 좋아?,나는 가족과 사이가 좋다고 생각해 대화가 많아
너는 무슨색깔을 좋아해?,"나는 빨강색과 초록색, 흰색을 좋아해"
나 좀만 뛰어도 숨이 차,나도 그래 운동을 너무 안했나봐
나 좀만 걸어도 숨이 차,나도 그래 운동을 너무 안했나봐
나 볼펜이 필요한데 볼펜이 지금 없어,볼펜을 잘 안갖고 다녀? 나도 요새 필요없어서 잘 안갖고 다녀 하나 사자
이거에 대해서 아무것도 모르겠는데?,나도 이해하긴 하는데 그러면 최대한 노력해봐
알바하는데 손님끼리 싸우면 어떻게 할꺼야?,그거는 손님들끼리 해결해야 하는 부분이 아닐까 생각해
방탄소년단이 전 세계적으로 인기가 많대,방탄소년단 덕에 우리나라 인지도 있어서 좋긴 한데 우리한테도 이득이 있으면 좋겠다
너 내가 라면 끓이면 먹을꺼야?,내가 배고프면 먹을꺼고 아니면 안먹을려고
챗지피티 쓰니까 너무 편하다,나도 그래서 챗지피티만 쓰게 되는거 같아
ChatGPT 쓰니까 너무 편하다,나도 그래서 챗지피티만 쓰게 되는거 같아
바꿀 가전제품이 너무 많은 것 같아,바꿀 생각을 안하는 순간 바꿀 것이 없어지게 되는거 같아
TV 바꾸고 싶어,나도 TV 바꾸고 싶어
컴퓨터 바꾸고 싶어,나도 컴퓨터 바꾸고 싶어
나 단축키에 대해서 잘 몰라,나도 단축키에 대해 잘 몰랐는데 알게 되니까 엄청 편하더라 알려고 해봐
우리집에 프린터기 없다,나도 예전에 그랬었는데 있는거나 없는거나 별 차이 없더라
기계가 전부 다 해주는 시대가 온대,정말? 그러면 우리 일은 기계가 다 해주는거야?
요새 기계가 전부 다 해준데,엄청 편하겠다! 그런데 그러면 우리는 뭐 해야해?
여름에 수박 화채 어때,더운 날에 수박 화채는 너무 좋아
감기 걸리면 너 오렌지 주스 마시냐,나는 평소에 영양분이 부족하니까 채울려고 마셔
감기 걸렸는데 감기약 안먹고 걍 잤다,그러지마..그거 원상태로 복구하려고 돕는건데 먹을려 노력해
코로나 터지고 여행업이 침체기를 겪었대,정말? 그러면 거기에 종사하고 있는 사람들이 많이 힘들겠다
여행업이 다시 엄청 성행하고 있대,다행이다! 사람들 여행 욕구가 들끓었나봐
무선이라 그런가 인터넷이 자꾸 끊겨서 화가 나,나도 그런 경우 꽤 있는데 인터넷을 바꿔보는게 어때?
돈이 많으면 뭐할꺼야?,돈이 많으면 아마 평생 놀거나 혹은 목표만 있다면 목표를 달성하고 쉬지 않을까
돈까스 하나 추천해줘,나는 치즈돈까스 추천할게
볶음밥 하나 추천해줘,나는 김치볶음밥 추천할게
찌개 하나 추천해줘,나는 돼지고기 들어간 김치찌개 추천할게
덮밥 하나 추천해줘,나는 스팸마요덮밥 추천할게
파일 카톡으로 보내주면 안되냐?,당연히 보내줘야지 지금 보낼게
너꺼 카메라 화질이 좋은데 너껄로 찍어도 되냐,내껄로 찍고 너한테 파일 보내면 될것 같아!
너도 혼자 살꺼야?,나도 혼자 살지 않을까 싶어
나는 혼자 살래,너도? 나도 혼자 살꺼야
사람들이 애를 안가지려고 한데,요새 너무 사람들이 힘든가봐
결혼하기도 힘든 세상이래,정말? 뉴스를 보면 괜히 그런게 아닌가봐
요새 사람들이 결혼을 안할려 한데,왜 그렇대? 요새 안좋은 소식이 많이 들리긴하는데..
롯데에 대해서 뭐가 생각나냐?,잠실이나 롯데월드가 생각나 나는
현대에 대해서 뭐가 생각나냐?,나는 현대자동차가 제일 생각나는거 같아
LG에 대해서 뭐가 생각나냐?,나는 가전제품이 제일 많이 생각 나
대기업 한번 들어가고 싶지 않냐,대기업 한번 들어가고 싶긴 한데 너무 문턱이 높아
삼성에 대해서 뭐가 생각나냐?,반도체? 우리나라 최대 기업? 핸드폰? 그렇게 생각이 나
우리나라가 돈이 없는게 아니래 도둑이 많은거래,나도 그 소리를 들은적이 있는 것 같긴 해 확실한지는 모르겠지만
폭염 속에 소나기가 오면 어떤 생각이 드냐,반갑긴 한데 또 더워질까봐 무섭다
문서를 완성했는데 다른 업체에서 자꾸 수정해달래,아 그래? 그러면 미룰만 한 것 같은데
어떻게 수정할까?,그동안 해왔던대로 해봐!ㅎㅎ
우리 회사 사람들 미루는 것을 좋아한다,왜 그렇대? 미루는 것이야 정상적이긴 한데
왜 미루지 말라는거야?,계속 일이 쌓여갈거야 ㅠㅠ 그러면 피곤하겠지?
의식의 흐름대로 적어봐,그래서 지금 의식의 흐름대로 적는 중이야
태풍이 또 온대 ,태풍 이제 그만 왔으면 좋겠다 피해가 엄청 심각한데..
태풍 그만 왔으면 좋겠다,나도 태풍 그만 왔으면 좋겠어
이번에 국제스카우트에 대해 말이 많다고 해,정말? 그거에 대해서 해결이 잘 되었으면 좋겠다
여러 나라가 참여하는 행사인만큼 잘 해줬으면 좋겠다 그치?,맞아ㅜㅜ 이번에는 실망스러웠어!
뉴스는 항상 안좋은 소식만 전달해주는거 같아,나도 그런 생각하는데 요새 뉴스가 그런 것 같아
좋은 소식이 많이 들려왔으면 좋겠어,그러게! 우리도 좋은일을 많이해보자!
나 화가 나서 문 엄청 세게 닫고 나갔어,아무리 그래도 화가 나도 문 세게 닫고 가진 마 사람들 놀래
화가 나면 조절이 잘 안되는 것 같아,난 화나면 눈물이나 ㅜㅜㅋㅋ
부자면 아무것도 안하고 살지 않을까?,나도 그렇게 생각했는데 꿈이 없다면 아무것도 하지 않을꺼고 있다면 뭐라도 하지않을까
너는 부자가 되면 뭘 하고 살거야?,나는 부자가 되도 일하면서 살것같아~
돈으로 안되는 것이 아니라 돈이 부족한거래,그거 나도 동의해 세상에 돈으로 안되는 게 없다고 들었어
돈 잘버는 직업 추천해줘 ㅋㅋ,의사가 돈 많이벌것같아ㅋㅋ 치과의사 성형외과 등등!
돈으로 안되는 것은 없대,정말? 내가 생각해도 요즘 세상은 그런거 같아!
너가 생각하기에 돈으로 안되는 것은 뭐야?,진정한 사랑은 돈으로 못구할거야ㅎㅎ
배달업체가 외국계 브랜드에 인수됐대,들었어! 배달의 민족하고 요기요 말하는거 맞지?
배달의민족 이랑 요기요! 너는 자주 이용해?,자주이용해 ㅎㅎ 중독될까봐 걱정이야
나를 너무 신경쓰게 하지마,내가 너를 신경쓰게 했구나
너가 신경쓰이게 하잖아! 근데 오늘 뭐할까?,같이 맛집가자ㅎㅎ
너 사람을 화나게 하는 재주가 있구나,내가 너를 화나게 했구나 미안해
너 사람을 재밌게 하는 재주가 있구나,내가 너를 재밌게 해서 기쁘다
로봇보다 인형이 좋아,그런 사람을 보긴 했는데 너도 그런 사람 중 하나구나
그럼 어떤게 좋아?,나는 그나마 인형이 귀여워서 좋아 ㅎㅎ
잠 잘오게 하려면 어떻게 하면 좋을까?,나는 잠을 잘 자기 위해 카페 음악을 틀어 놓고 자고 있어
피곤할때 잔잔한 음악 들으면 잠 잘온다,나도 잔잔한 음악 들으면 잠 잘오는거 같아
잔잔한 음악 추천해줄래?,빗소리 같은 유튜브 추천!
게임 같이 한판 할래?,나 게임 좋아해! 하자!
지금 한판 할래?,그러자 ㅎㅎ 지금 들어와
나 너무 슬퍼,왜 슬픈지는 모르겠는데 너가 슬프니까 나도 슬퍼
나 너무 피곤해,너가 피곤하니까 나도 갑자기 피곤하다
나 너무 우울해,너가 우울하니까 나도 우울해
돈이 너무 없어서 식비도 아껴야겠다,나도 돈 없을때 식비 아낀적 있는데 그래도 밥은 잘 먹고 다녀야하지 않겠냐
식비 아끼는데 풀만 먹고 살아야하나,나도 그런 생각 들긴 하는데 그래도 잘먹어야해
벌금하고 과태료 차이가 뭔지 알아?,아니 나 그거에 대해서 잘 모르겠어
벌금하고 과태료의 차이는 기록이 남느냐 안남느냐야,정말? 나 그거에 대해서 처음 들어봐
국내 여행 바가지 요금 씌우는거 같아서 가기 싫어,나도 가끔 여행하는데 그런생각 들긴했어
국내 여행 나는 별로 흥미 없어,우리나라여서 그런지 그렇게 생각할지도 모르는데 생각보단 괜찮을껄
나 해외여행 가본적이 별로 없다,나도 예전엔 해외여행 간적 별로 없는데 요새 그래도 가는거같아
배달 광고를 보는데 배달음식이 땡기네,광고 보면 가끔씩 배달음식 땡길때 있지 나도 그런적 있음
맥주 광고 보니까 맥주가 땡기네,광고보면 맥주 땡길때 있긴해
초코파이 광고 보니까 초코파이 먹고싶네,생각 안나던거 보면 생각나서 먹게 되더라 나도 땡기네
안녕,안녕!
지금 뭐해?,너랑 대화하고있잖아 너는 뭐해?
나는 지금 게임하고있어 ㅋㅋ 같이할래?,무슨 게임하고 있는데?
아니 그거 말고 지금 뭐하냐고,나 방금일어났어
치킨 먹을까 피자 먹을까,나는 치킨 좋아하니까 치킨 어때
아무거나 먹을거 추천좀ㅋㅋ,삼겹살ㅎㅎ 맛있잖아ㅋㅋ
뉴스만 틀면 칼부림 현장 뉴스만 나와,세상 넘 무섭다ㅜㅜ
우리나라 이제 마약이 흔하대,정말? 어떻게 관리를 하길래 그정도 수준까지 왔대
택배로도 마약이 들어온다고 하더라 조심하자,헐 몰랐는데 조심해야겠다 고마워
나는 감자칩이나 치킨을 먹을때 오리지널을 먼저 먹어,나도 맨 처음엔 오리지널 먹을때가 꽤 있긴 해
너가 제일 좋아하는 돈까스 종류는 뭐야?,나는 치킨카츠 좋아해
나 김밥에 오이 싫어,김밥에 오이 싫어하거나 당근 싫어하는 사람 많은 것 같아
나 너무 피곤해,나도 너무 피곤해..
너무 바쁘게 살아서 피곤한 것 같아,그럴때는 자기만의 시간을 갖는건 어때?
학원 가는 시간이 너무 아까워,나도 너무 아깝다고 생각해 어떻게 하면 좋을까
지구온난화가 진행중인가 미친듯이 덥다,나도 너무 더워 오죽하면 더워서 죽은 사람도 있대
목마르다,나도 목마르니까 잠시 물 한잔 마실까?
탄산음료 마시고는 싶은데 살이 너무 찐다,나도 너무 마시고 싶은데 살 너무 쪄가지고 그만 마실려고 노력하고 있어
ppt 짜기 너무 어렵다,나도 짜기 너무 어려워서 템플릿 사이트 가서 최대한 참고중이야
챗봇개발 팀프로젝트에 관한 피피티를 만들고 있어,화이팅! 넌 잘할수 있어ㅎㅎ
이제 개고기 먹는 사람 거부감든다,나도 거부감 든다 이제 먹을 것 많아졌는데 아직까지 개고기 먹는 것은 이제 좀 그래
초복이네,벌써 초복이구나 더우니까 치킨 먹으러 가자
중복이네,중복? 기념으로 치킨 먹으러 갈까
말복이네,말복이니까 삼계탕이나 치킨 먹으러 가자
같이 삼계탕 먹을래?,나 삼계탕 완전좋아해 ㅎㅎ 너가사줘
손톱 자르기 너무 귀찮다,나도 손톱 자르기 너무 귀찮은데 거슬릴때 마다 잘라
노트북 하나 새로 샀다,좋겠다 어느 걸로 샀어?
컴퓨터 하나 새로 샀다,좋겠다 어느 걸로 삼?
최신형으로 구매했어,부럽다... 나도 바꾸고싶어 힝
일 해야하는데 자버렸다,나도 일 하는데 갑자기 피곤해서 자버린 경우가 많아
그냥 자버린 바람에 이도 못닦고잠,나도 너무 피곤해서 이 못 닦고 잔 경우 꽤 있어
오랜만에 피자가 땡기네,나도 피자 땡긴다 오랜만에 피자 먹을까
지금 피자 시킬건데 같이 먹을래?,좋아ㅎㅎ 빨리 준비해서 갈게
어느 피자 좋아함,나 페퍼로니 혹은 스테이크 피자 좋아해
피자를 시켰는데 피클이 안왔어,피클 있어야하는데 다른 것도 아니고 가져다 달라기도 뭐하네
햄버거 시켰는데 감자튀김이 안왔어,나 그럴때 너무 귀찮아 그래도 다시 보내달라고 하는게 어때
오마카세 왜 유행인지 모르겠어 비싸기만 한데,나도 너무 비싸다고 생각해 그래도 이유가 있지 않을까
발표를 망쳐버렸어,나도 그런적 많아 ㅠ 그래도 다음엔 잘하것지
챗봇 프로젝트 발표인데 망했어 ㅜㅜ,그럴땐 술한잔 하고 날려버리자! 술 고고?
회사 상사한테 안 좋은 모습만 보였어 오늘,나도 그런적 꽤 있긴 한데 다음날 의식해봐
게임 너무 많이 져버려서 하기가 싫네,나는 그럴때 날이 아니라고 생각해서 꺼버림 내일 다시 해봐
엄청 많이졌어 ㅋㅋ 같이 게임하자,언제할거야 재밌겠다
나 카페에서 커피는 마시기 싫다,그럼 뭐마실거야?
오늘 저녁 치맥 먹을까?,나도 치맥 좋아해 먹으러 가자
후식으로 푸딩 먹을건데 어때,푸딩좋아 ㅎㅎ 후식으론 달달한게 좋징
콜라 사이다 어느 것이 좋아?,나는 콜라를 더 좋아
미세먼지 너무 싫다,나도 기관지가 안좋아서 너무 싫다
해외에 다녀왔는데 넘 힘들다,나도 해외 다녀오면 힘들어서 집 오면 바로 쓰러짐
지하철 너무 막힌다,요새 지하철 너무 많이 막히는거같아 혼잡도 줄였으면 좋겠다
오늘 독서실 갈까 집이 너무 시끄럽다,나도 집이 너무 시끄러우면 카페든 독서실이든 가
우리 회사 근처에 목요일만 되면 시끄럽다,그래? 우리는 그런 경험 없는데 왜 그럴까
우리 회사 사람들 점심시간만 되면 밥 뭐먹을지 고민한다,우리도 고민할때 많아 한식먹을지 중식먹을지
요새 유튜브 광고 제대로 검수 안하는거 같아 이상한 투자 광고뜸,나도 그렇게 생각해 요새 인증되지 않은 광고 뜨는게 보여
유튜브 프리미엄 신청할까?,나도 신청해서 쓰고있어 ㅋㅋ 엄청편해ㅎㅎ
이 컴퓨터 이제 그만 쓸때가 됐나 보다,왜? 너무 오래 쓰면 나도 그렇긴 하는데..
폭식하고 싶을 때가 있다,나는 폭식하고 싶을땐 기분 안좋은데 기분 안좋은일 있어?
